{
  "$schema": "https://json-schema.org/draft/2020-12/schema",
  "$id": "https://genuity.io/contracts/field-decision-v1.schema.json",
  "title": "Genuity evidence-linked field decision",
  "type": "object",
  "required": [
    "field_id",
    "document_id",
    "name",
    "value",
    "original_extraction",
    "status",
    "acceptance",
    "evidence_ids",
    "method",
    "rationale",
    "safe_for_operational_use",
    "analytics_only"
  ],
  "properties": {
    "field_id": {
      "type": "string"
    },
    "document_id": {
      "type": "string"
    },
    "name": {
      "type": "string"
    },
    "value": {},
    "unit": {
      "type": [
        "string",
        "null"
      ]
    },
    "original_extraction": {},
    "status": {
      "type": "string"
    },
    "acceptance": {
      "enum": [
        "ACCEPTED",
        "REVIEW",
        "NOT_ACCEPTED",
        "ANALYTICS_ONLY"
      ]
    },
    "confidence": {
      "type": "number",
      "minimum": 0,
      "maximum": 1
    },
    "critical": {
      "type": "boolean"
    },
    "evidence_ids": {
      "type": "array",
      "items": {
        "type": "string"
      }
    },
    "method": {
      "type": "string"
    },
    "rationale": {
      "type": "string"
    },
    "rule_results": {
      "type": "array"
    },
    "alternatives_rejected": {
      "type": "array"
    },
    "safe_for_operational_use": {
      "type": "boolean"
    },
    "analytics_only": {
      "type": "boolean"
    },
    "requires_human_confirmation": {
      "type": "boolean"
    }
  },
  "additionalProperties": false
}