[
  {
    "field_id": "FD-01_PURCHASE_ORDER-po_number",
    "document_id": "01_PURCHASE_ORDER",
    "name": "po_number",
    "value": "PO-1001",
    "unit": null,
    "original_extraction": "PO-1001",
    "status": "OBSERVED",
    "acceptance": "ACCEPTED",
    "confidence": 0.99,
    "critical": true,
    "evidence_ids": [
      "EV-01_PURCHASE_ORDER-001"
    ],
    "method": "existing_ocr",
    "rationale": "Value supplied by the existing OCR adapter.",
    "rule_results": [],
    "alternatives_rejected": [],
    "safe_for_operational_use": true,
    "analytics_only": false,
    "requires_human_confirmation": false
  },
  {
    "field_id": "FD-01_PURCHASE_ORDER-supplier",
    "document_id": "01_PURCHASE_ORDER",
    "name": "supplier",
    "value": "Apex Metals",
    "unit": null,
    "original_extraction": "Apex Metals",
    "status": "OBSERVED",
    "acceptance": "ACCEPTED",
    "confidence": 0.99,
    "critical": false,
    "evidence_ids": [
      "EV-01_PURCHASE_ORDER-002"
    ],
    "method": "existing_ocr",
    "rationale": "Value supplied by the existing OCR adapter.",
    "rule_results": [],
    "alternatives_rejected": [],
    "safe_for_operational_use": true,
    "analytics_only": false,
    "requires_human_confirmation": false
  },
  {
    "field_id": "FD-01_PURCHASE_ORDER-part_number",
    "document_id": "01_PURCHASE_ORDER",
    "name": "part_number",
    "value": "PN-70725",
    "unit": null,
    "original_extraction": "PN-70725",
    "status": "OBSERVED",
    "acceptance": "ACCEPTED",
    "confidence": 0.99,
    "critical": true,
    "evidence_ids": [
      "EV-01_PURCHASE_ORDER-003"
    ],
    "method": "existing_ocr",
    "rationale": "Value supplied by the existing OCR adapter.",
    "rule_results": [],
    "alternatives_rejected": [],
    "safe_for_operational_use": true,
    "analytics_only": false,
    "requires_human_confirmation": false
  },
  {
    "field_id": "FD-01_PURCHASE_ORDER-material_grade",
    "document_id": "01_PURCHASE_ORDER",
    "name": "material_grade",
    "value": "INCONEL 725",
    "unit": null,
    "original_extraction": "INCONEL alloy 725",
    "status": "NORMALISED",
    "acceptance": "ACCEPTED",
    "confidence": 0.99,
    "critical": true,
    "evidence_ids": [
      "EV-01_PURCHASE_ORDER-004"
    ],
    "method": "alias_normalisation",
    "rationale": "Mapped a configured material-grade alias to the canonical grade.",
    "rule_results": [
      {
        "rule": "material_grade_alias",
        "result": "PASS"
      }
    ],
    "alternatives_rejected": [],
    "safe_for_operational_use": true,
    "analytics_only": false,
    "requires_human_confirmation": false
  },
  {
    "field_id": "FD-01_PURCHASE_ORDER-quantity",
    "document_id": "01_PURCHASE_ORDER",
    "name": "quantity",
    "value": 45,
    "unit": "pcs",
    "original_extraction": 45,
    "status": "OBSERVED",
    "acceptance": "ACCEPTED",
    "confidence": 0.99,
    "critical": true,
    "evidence_ids": [
      "EV-01_PURCHASE_ORDER-005"
    ],
    "method": "existing_ocr",
    "rationale": "Value supplied by the existing OCR adapter.",
    "rule_results": [],
    "alternatives_rejected": [],
    "safe_for_operational_use": true,
    "analytics_only": false,
    "requires_human_confirmation": false
  },
  {
    "field_id": "FD-01_PURCHASE_ORDER-unit_price",
    "document_id": "01_PURCHASE_ORDER",
    "name": "unit_price",
    "value": 125.0,
    "unit": "USD",
    "original_extraction": 125.0,
    "status": "OBSERVED",
    "acceptance": "ACCEPTED",
    "confidence": 0.99,
    "critical": false,
    "evidence_ids": [
      "EV-01_PURCHASE_ORDER-006"
    ],
    "method": "existing_ocr",
    "rationale": "Value supplied by the existing OCR adapter.",
    "rule_results": [],
    "alternatives_rejected": [],
    "safe_for_operational_use": true,
    "analytics_only": false,
    "requires_human_confirmation": false
  },
  {
    "field_id": "FD-01_PURCHASE_ORDER-total_amount",
    "document_id": "01_PURCHASE_ORDER",
    "name": "total_amount",
    "value": 5625.0,
    "unit": "USD",
    "original_extraction": null,
    "status": "DERIVED_DETERMINISTIC",
    "acceptance": "ACCEPTED",
    "confidence": 0.99,
    "critical": false,
    "evidence_ids": [
      "EV-01_PURCHASE_ORDER-007",
      "EV-01_PURCHASE_ORDER-005",
      "EV-01_PURCHASE_ORDER-006"
    ],
    "method": "quantity_times_unit_price",
    "rationale": "Calculated deterministically as quantity multiplied by unit price.",
    "rule_results": [
      {
        "rule": "quantity_times_unit_price",
        "result": "PASS",
        "inputs": {
          "quantity": 45,
          "unit_price": 125.0
        }
      }
    ],
    "alternatives_rejected": [],
    "safe_for_operational_use": true,
    "analytics_only": false,
    "requires_human_confirmation": false
  },
  {
    "field_id": "FD-01_PURCHASE_ORDER-revision",
    "document_id": "01_PURCHASE_ORDER",
    "name": "revision",
    "value": 3,
    "unit": null,
    "original_extraction": 3,
    "status": "OBSERVED",
    "acceptance": "ACCEPTED",
    "confidence": 0.99,
    "critical": false,
    "evidence_ids": [
      "EV-01_PURCHASE_ORDER-008"
    ],
    "method": "existing_ocr",
    "rationale": "Value supplied by the existing OCR adapter.",
    "rule_results": [],
    "alternatives_rejected": [],
    "safe_for_operational_use": true,
    "analytics_only": false,
    "requires_human_confirmation": false
  },
  {
    "field_id": "FD-02_SUPPLIER_INVOICE-invoice_number",
    "document_id": "02_SUPPLIER_INVOICE",
    "name": "invoice_number",
    "value": "INV-8821",
    "unit": null,
    "original_extraction": "INV-8821",
    "status": "OBSERVED",
    "acceptance": "ACCEPTED",
    "confidence": 0.99,
    "critical": false,
    "evidence_ids": [
      "EV-02_SUPPLIER_INVOICE-001"
    ],
    "method": "existing_ocr",
    "rationale": "Value supplied by the existing OCR adapter.",
    "rule_results": [],
    "alternatives_rejected": [],
    "safe_for_operational_use": true,
    "analytics_only": false,
    "requires_human_confirmation": false
  },
  {
    "field_id": "FD-02_SUPPLIER_INVOICE-po_number",
    "document_id": "02_SUPPLIER_INVOICE",
    "name": "po_number",
    "value": "PO-1001",
    "unit": null,
    "original_extraction": "PO-1001",
    "status": "OBSERVED",
    "acceptance": "ACCEPTED",
    "confidence": 0.99,
    "critical": true,
    "evidence_ids": [
      "EV-02_SUPPLIER_INVOICE-002"
    ],
    "method": "existing_ocr",
    "rationale": "Value supplied by the existing OCR adapter.",
    "rule_results": [],
    "alternatives_rejected": [],
    "safe_for_operational_use": true,
    "analytics_only": false,
    "requires_human_confirmation": false
  },
  {
    "field_id": "FD-02_SUPPLIER_INVOICE-supplier",
    "document_id": "02_SUPPLIER_INVOICE",
    "name": "supplier",
    "value": "Apex Metals",
    "unit": null,
    "original_extraction": "Apex Metals",
    "status": "OBSERVED",
    "acceptance": "ACCEPTED",
    "confidence": 0.99,
    "critical": false,
    "evidence_ids": [
      "EV-02_SUPPLIER_INVOICE-003"
    ],
    "method": "existing_ocr",
    "rationale": "Value supplied by the existing OCR adapter.",
    "rule_results": [],
    "alternatives_rejected": [],
    "safe_for_operational_use": true,
    "analytics_only": false,
    "requires_human_confirmation": false
  },
  {
    "field_id": "FD-02_SUPPLIER_INVOICE-part_number",
    "document_id": "02_SUPPLIER_INVOICE",
    "name": "part_number",
    "value": "PN-70725",
    "unit": null,
    "original_extraction": null,
    "status": "RECOVERED_CROSS_DOCUMENT",
    "acceptance": "ACCEPTED",
    "confidence": 0.99,
    "critical": true,
    "evidence_ids": [
      "EV-02_SUPPLIER_INVOICE-004",
      "EV-01_PURCHASE_ORDER-003"
    ],
    "method": "cross_document_exact_join",
    "rationale": "Recovered from the authoritative purchase order only after exact PO-number and supplier corroboration.",
    "rule_results": [
      {
        "rule": "exact_po_number_join",
        "result": "PASS",
        "key": "PO-1001"
      },
      {
        "rule": "supplier_corroboration",
        "result": "PASS",
        "value": "Apex Metals"
      }
    ],
    "alternatives_rejected": [],
    "safe_for_operational_use": true,
    "analytics_only": false,
    "requires_human_confirmation": false
  },
  {
    "field_id": "FD-02_SUPPLIER_INVOICE-quantity",
    "document_id": "02_SUPPLIER_INVOICE",
    "name": "quantity",
    "value": 44,
    "unit": "pcs",
    "original_extraction": 44,
    "status": "OBSERVED",
    "acceptance": "ACCEPTED",
    "confidence": 0.99,
    "critical": true,
    "evidence_ids": [
      "EV-02_SUPPLIER_INVOICE-005"
    ],
    "method": "existing_ocr",
    "rationale": "Value supplied by the existing OCR adapter.",
    "rule_results": [],
    "alternatives_rejected": [],
    "safe_for_operational_use": true,
    "analytics_only": false,
    "requires_human_confirmation": false
  },
  {
    "field_id": "FD-02_SUPPLIER_INVOICE-unit_price",
    "document_id": "02_SUPPLIER_INVOICE",
    "name": "unit_price",
    "value": 125.0,
    "unit": "USD",
    "original_extraction": 125.0,
    "status": "OBSERVED",
    "acceptance": "ACCEPTED",
    "confidence": 0.99,
    "critical": false,
    "evidence_ids": [
      "EV-02_SUPPLIER_INVOICE-006"
    ],
    "method": "existing_ocr",
    "rationale": "Value supplied by the existing OCR adapter.",
    "rule_results": [],
    "alternatives_rejected": [],
    "safe_for_operational_use": true,
    "analytics_only": false,
    "requires_human_confirmation": false
  },
  {
    "field_id": "FD-02_SUPPLIER_INVOICE-total_amount",
    "document_id": "02_SUPPLIER_INVOICE",
    "name": "total_amount",
    "value": 5500.0,
    "unit": "USD",
    "original_extraction": 5500.0,
    "status": "OBSERVED",
    "acceptance": "ACCEPTED",
    "confidence": 0.99,
    "critical": false,
    "evidence_ids": [
      "EV-02_SUPPLIER_INVOICE-007"
    ],
    "method": "existing_ocr",